sentence_id_1,sentence_id_2,answers_12,reasonings_12,comment_12,llm_confidence_12,llm_conclusion_12
S0051714006p,B0016009p,"NO, NO, NO","1. (NO) Logically, Statement 1 addresses the source of legitimacy in governance (popular will), whereas Statement 2 defines the purpose of civil society (protection of property and rights through collective governance). These are distinct concepts; one can endorse popular will without accepting that protection of property and rights is the essence of civil society. For example, a democratic system could prioritize collective welfare over individual rights, showing no entailment.
2. (NO) Contextually, Argument 1 is rooted in the specific political debates of Interregnum England, focusing on the legitimacy of laws and the need for transparency. It does not explicitly discuss the protection of property or individual rights as the essence of civil society. Argument 2, from Marsilius of Padua, presents a theoretical critique of absolute monarchy, defining civil society in a particular way. The different concerns and historical settings mean that Statement 1, derived from a speech about governance flaws, does not entail Statement 2's definition of civil society.
3. (NO) From the authors' perspectives, the speaker in Argument 1 likely advocates for accountability and popular sovereignty in the context of post-Civil War England, but does not necessarily endorse the specific formulation of civil society given in Statement 2. Marsilius, writing in the 14th century, argues against papal temporal power and emphasizes collective governance, but his view might not be directly entailed by the normative claim about governance reflecting the people's will. One could agree with Statement 1 while holding a different view of civil society's essence, such as it being about the common good or moral order.","While both statements oppose arbitrary rule and emphasize collective governance, Statement 1 is a normative claim about legitimacy, and Statement 2 is a definitional claim about civil society. They are related but not logically entailed; one can be true without the other. My confidence is high but not absolute due to the potential for interpretation within broader political theory.",3,NO
S0022722002p,B0159004p,"NO, YES, NO","1. NO: Statement 1 addresses a specific political right (accountability) from Argument 1, while Statement 2 makes a general claim about human nature (rational submission) from Argument 2; there is no logical necessity that one implies the other. 2. YES: Both statements are rooted in Enlightenment ideas of natural rights and social contract; Statement 1's 'inherent right' in Argument 1 suggests rational agency, which aligns with Statement 2's emphasis on rational nature in Argument 2. 3. NO: The contexts differ: Statement 1 arises from a specific historical moment (post-Glorious Revolution) focusing on accountability, while Statement 2 is from a philosophical treatise on governance; entailment is not supported by these divergent contexts.","I am fairly confident because the statements are logically distinct, but the shared philosophical background introduces some uncertainty, making me not absolutely sure.",3,NO
S0019465002sc,B0325005sc,"NO, NO, NO","Answer 1: NO because Statement 1 ('to serve justice') is an action-oriented phrase focused on procedural justice within a legal framework, as seen in Argument 1's emphasis on allowing accusations to be presented and oaths made. This does not logically imply Statement 2's claim about a king's stability relying on natural laws, which is a broader ethical claim from Argument 2. Answer 2: NO because the historical contexts differ; Argument 1 is rooted in the specific political turmoil of 1678 England concerning the Popish Plot and legal procedures, while Argument 2 discusses general principles of kingship and natural law from a 1471 treatise. There is no direct link between the immediate justice in Statement 1 and the stability condition in Statement 2. Answer 3: NO because the philosophical foundations are distinct; justice in Argument 1 is based on the rule of law, Protestant establishment, and parliamentary authority, whereas natural laws in Argument 2 are derived from divine and moral sources. Serving justice in Argument 1 does not entail commitment to natural laws as required for king's stability in Argument 2.","I am mostly confident because the statements arise from different historical contexts, purposes, and philosophical bases, reducing the likelihood of entailment. However, I acknowledge that in some broad interpretations, justice and natural law could be connected, which slightly tempers my certainty.",3,NO
S0022920005p,B0345008p,"NO, YES, NO","1. NO: In Argument 1, Statement 1 is grounded in the principle of legal equality and inheritance, where Crown rights are tied to people's rights to limit arbitrary power, not to establish popular approval as a condition for legitimacy. The context emphasizes James II's inherent rights akin to private property, not consent.
2. YES: If the rights of the Crown are fundamentally tied to the rights of the people, then ultimate authority resides with the people, making their approval essential. This view is supported by Argument 2's emphasis on popular establishment and the Glorious Revolution's shift toward parliamentary sovereignty.
3. NO: Statement 1 asserts a connection but does not specify dependency; it could mean the Crown must protect people's rights without requiring their approval for legitimacy. Historical examples like absolute monarchies show Crown rights tied to welfare but legitimacy based on dynasty, not consent.","I am fairly confident due to the distinct perspectives of the arguments, but acknowledge some philosophical overlap that could suggest entailment in certain interpretations.",3,NO
S0023850002sc,B0179005sc,"YES, YES, NO","1. YES: In Argument 1, reflecting the will of the people is explicitly linked to parliamentary processes, which are societal frameworks that define and limit the ruler's power. The argument insists on collective approval and democratic principles, indicating that such frameworks are necessary for the will of the people to be reflected. 2. YES: Argument 2 argues that true authority is bound by law and consent, which are societal frameworks. The historical examples show that even kings were subject to these frameworks. Therefore, if governance reflects the will of the people (Statement 1), it must operate within societal frameworks that define power (Statement 2). 3. NO: Statement 1 expresses a purpose or ideal, but does not logically necessitate that societal frameworks define rulers' power. A ruler could reflect the will of the people through ad hoc means without formal frameworks. Argument 2 acknowledges that societal frameworks are important, but it does not prove that reflecting the will of the people inherently requires such frameworks; it only shows that in practice, frameworks help limit power.","I am reasonably confident because both arguments strongly associate the will of the people with institutional constraints, but there is a slight logical gap between a goal and the means to achieve it. The contexts emphasize the importance of laws and parliamentary systems, making the entailment likely in these historical settings, but not absolute.",3,YES
S0024409007p,B0775005p,"NO, YES, NO","1. Logically, Statement 1 is a prescriptive claim about vigilance, while Statement 2 is a descriptive claim about royal authority; there is no necessary implication between them. 2. In the historical context of Argument 1, vigilance against encroachments presupposes limited monarchy and popular sovereignty, suggesting entailment. 3. The statements come from distinct arguments; one can agree with vigilance without agreeing that the king's authority is subject to the people, as vigilance could be a moral stance even under absolute monarchy.","While both statements are aligned with anti-absolutist ideology, Statement 1 does not strictly entail Statement 2; one could coherently hold Statement 1 without Statement 2, though historically they often coexist.",3,NO
S0023982006p,B0699010p,"YES, NO, NO","1. YES: In the historical context of Argument 1, the Glorious Revolution led to the establishment of constitutional instruments like the Bill of Rights, which are forms of civil law aimed at limiting arbitrary power and promoting justice. Since Statement 1 calls for a government adhering to the rule of law, and such rule of law is embodied in civil law, Statement 1 implies that civil law (as part of that framework) promotes a just and harmonious society. 2. NO: Statement 1 is a normative claim about the need for a certain type of government, while Statement 2 is a positive claim about the effect of civil law. Even if such a government is needed, it does not logically follow that civil law necessarily promotes justice and harmony; civil law could be unjust or ineffective, and other factors (e.g., cultural norms) might be primary. 3. NO: The authors' perspectives differ: Grey (Argument 1) focuses on accountability and the rule of law in the specific context of condemning unlawful power, without explicit mention of civil law. Althusius (Argument 2) emphasizes civil law as a check on the ruler. While both value justice, Statement 1 does not address civil law specifically, so it does not entail Statement 2.","While there are contextual connections between the statements, logical entailment is not strict. Statement 1 does not guarantee the truth of Statement 2, as they make different types of claims. However, considering the historical and philosophical contexts, there is a reasonable association but not necessary implication.",3,NO
S0051646005p,B0427007p,"YES, NO, YES","Answer 1 (YES): Both statements express a core principle that responsive governance leads to political support. Statement 1 is a general claim about government prioritizing citizens' needs fostering trust and cooperation. Since it does not specify government type, it applies to monarchies as well, implying that a just king who engages with communities (a form of prioritizing needs) fosters loyalty and support, which is Statement 2. Thus, Statement 1 entails Statement 2.

Answer 2 (NO): The contexts of the arguments differ significantly. Statement 1 comes from a republican context (Interregnum England) where the government is non-monarchical, and 'trust and cooperation' may refer to a different kind of relationship than 'loyalty and support' in a monarchy. Statement 2 specifically involves the mechanism of engaging with Estates, which is a particular institutional form not implied by Statement 1. Therefore, the truth of Statement 1 does not necessarily guarantee the truth of Statement 2, as the latter depends on specific monarchical dynamics.

Answer 3 (YES): Despite different historical settings, both arguments highlight the necessity of addressing popular concerns for stability. Argument 1 stresses fulfilling expectations to foster trust and cooperation during the Interregnum. Argument 2 asserts that a just king must engage with communities to foster loyalty and support. The underlying logic is consistent: attending to the populace yields political benefits. Hence, if Statement 1 is true as a general principle, Statement 2 follows as a particular instance in a monarchy.","I am fairly confident that Statement 1 entails Statement 2 because both express a similar principle of responsive governance leading to support, and Statement 1 is general enough to cover monarchies. However, the different contexts and specific wording introduce some uncertainty, preventing a score of 4.",3,YES
S0020998010p,B0165006p,"NO, NO, NO","1. Logical independence: Statement 1 asserts a normative need to protect rights, but does not specify means; Statement 2 describes a specific institutional mechanism. The truth of Statement 1 does not logically necessitate the truth of Statement 2, as rights could be protected through other means (e.g., rule of law, independent judiciary, or a benevolent monarch). 2. Different emphasis in arguments: Argument 1 focuses on individual oath, truth, and accountability, with no mention of assemblies or councils as necessary checks. Thus, from the context of Argument 1, Statement 1 does not entail Statement 2. 3. Historical and ideological context: While both arguments oppose absolute monarchy, Statement 1 could be endorsed by those who support royal prerogative tempered by traditional laws, without endorsing popular assemblies. Therefore, Statement 1 does not entail Statement 2.","I am fairly confident because entailment requires logical necessity, and Statement 1 does not imply Statement 2 as a matter of logic, even though both statements align with limiting royal power. The historical context shows overlapping but distinct ideas.",3,NO
nan,nan,"NO, NO, NO","1. Both statements are 'nan', which are not meaningful propositions, so Statement 1 cannot logically entail Statement 2. 2. In the absence of any content in the statements, arguments, or contexts, there is no basis to establish a relationship of entailment. 3. Without author perspective, historical context, or specific terms, it is impossible to infer any contextual equivalence or logical implication between the statements.","The statements are 'nan' and contexts are 'None', making it impossible to assess entailment meaningfully. Therefore, confidence is minimal.",0,NO
S0020349003p,B0710010p,"YES, YES, NO","1. YES: Statement 1 implies that royal authority is not absolute and that there are higher principles (like due process and rule of law) that bind it, which aligns with Statement 2's claim that authority is bound by justice and common good. Evidence from Argument 1 includes emphasis on due process and that officials should not be shielded simply because they act under royal command, indicating that royal command does not override legal and ethical standards. 2. YES: In the historical context of Argument 1, the growing sentiment in Parliament was to limit monarchical power in favor of the rights of officials and the people, which is an instance of the commonwealth's authority being bound by principles of justice and the common good as argued in Argument 2. Evidence: Argument 1 references 'the growing sentiment within Parliament that the prerogatives of the monarchy should not infringe upon the rights and responsibilities of its officials,' reflecting a concern for the common good. 3. NO: Statement 1 focuses on the accountability of individual officials, while Statement 2 addresses the limits of the commonwealth's authority as a whole. One could coherently hold that officials should be held accountable for following unjust orders without committing to the view that the commonwealth's authority is bound by justice and the common good; for example, accountability might be a pragmatic tool to maintain order, not necessarily rooted in justice. Therefore, Statement 1 does not logically entail Statement 2.","While both statements advocate for limitations on power, Statement 1 is a specific claim about official accountability, whereas Statement 2 is a broad principle about the commonwealth's authority. The entailment is not logically necessary, and the contexts differ, though they share similar themes.",2,NO
S0022920005p,B0190007p,"YES, YES, NO","1. In the historical context of Argument 1, tying Crown rights to people's rights was part of establishing constitutional monarchy, implying the king must safeguard against arbitrary power, which aligns with ensuring justice and welfare; 2. Philosophically, if Crown rights derive from people's rights, a legitimate king's authority depends on protecting those rights, so he must command justly and for welfare; 3. Statement 1 only asserts a correlation, not an active duty, so a king could acknowledge the tie yet act unjustly, meaning Statement 1 does not logically necessitate Statement 2.","The shared context of limiting royal power in 17th-century England strongly suggests entailment, but logical nuance prevents absolute certainty.",3,YES
S0023850008p,B1191002p,"NO, NO, NO","1. NO, because logically, Statement 1 is a normative claim about governance reflecting the people's will, while Statement 2 is a descriptive claim about the source of authority; the truth of Statement 1 does not necessitate Statement 2, as governance could reflect the will even if authority derives from other sources (e.g., divine right). 2. NO, because in the context of Argument 1, governance reflecting the will is tied to parliamentary processes, not necessarily to the derivation of authority from the people; the argument focuses on collective approval without explicitly stating that the monarch's authority originates from the populace. 3. NO, because philosophically, Statement 1 is a weaker condition than Statement 2; a ruler could choose to govern in line with the people's will without their authority being derived from the people, so Statement 1 does not entail the stronger claim of Statement 2.","I am completely confident because the statements are logically distinct: one prescribes how governance should function, while the other describes the origin of authority. There is no necessary implication from one to the other, even when considering the historical and philosophical contexts provided.",4,NO
S0023261010p,B0253007p,"NO, YES, NO","1. NO: Statement 1 does not entail Statement 2 because resisting arbitrary governance can be based on principles like rule of law or religious integrity, without necessarily relying on consent of the governed. Argument 1 emphasizes threats to Protestant establishment and rule of law, not popular consent. 2. YES: In the historical context of the Glorious Revolution, resisting arbitrary governance was closely tied to establishing authority through consent, as seen in Parliament's role in inviting William and Mary and drafting the Bill of Rights, linking Statement 1 to Statement 2. 3. NO: The statements derive from different arguments with distinct perspectives; Argument 1 focuses on preserving rights against arbitrary power, while Argument 2 highlights consent for legitimacy, so Statement 1 does not logically imply Statement 2.","I am reasonably confident because, despite historical connections, the statements do not have a strict logical entailment; context suggests overlap but not necessity.",3,NO
S0051998007p,B0699005p,"YES, YES, NO","1. (YES) Philosophical perspective: Statement 1's assertion that people deserve a government reflecting their collective will implies that legitimate governance is based on the consent of the governed, which aligns with Statement 2's claim that the bond of a commonwealth is built on consensus and trust. Thus, entailment holds. 2. (YES) Historical and contextual perspective: Both arguments, despite different contexts, share a common theme that political authority derives from the people. Argument 1's warning against autocracy and Argument 2's theory of popular sovereignty support the idea that Statement 1 entails Statement 2 within these frameworks. 3. (NO) Logical perspective: Statement 1 is a normative claim about what ought to be, while Statement 2 is a descriptive claim about what is. The truth of a normative claim does not logically guarantee the truth of a descriptive claim; it is possible for people to deserve a government based on their will even if actual commonwealths are not bonded by consensus and trust.","While there is a strong conceptual connection between the statements in their respective contexts, the normative/descriptive distinction introduces some uncertainty, hence confidence is not absolute.",3,YES
S0020983005p,B0860003p,"NO, NO, NO","1. Logical analysis: Statement 1 is a general principle about the importance of order and fairness in governance, while Statement 2 assigns a specific responsibility to a king as the highest authority. There is no logical necessity that the importance of order and fairness implies that a king must be tasked with ensuring safety and well-being, as other entities (e.g., parliament, councils) could be responsible. 2. Historical context of Argument 1: The argument is from a Whig perspective during the Exclusion Crisis, emphasizing parliamentary sovereignty and limiting royal power. Statement 1 is used to support checks on potential abuses, not to affirm the king's role. Thus, in this context, Statement 1 does not entail Statement 2. 3. Authors' perspectives: The author of Argument 2 (John Maxwell) is a royalist advocating divine right of kings, while the author of Argument 1 (Sir Henry Grey) is a Whig likely viewing Parliament as the highest authority. Therefore, Statement 1 in the Whig context does not entail that a king is the highest authority tasked with ensuring safety and well-being.","I am quite confident but not absolutely certain because while logical and contextual analysis strongly suggests no entailment, there is a possibility that in a monarchy context, maintaining order and fairness could be seen as the king's duty. However, given the specific arguments and their opposing stances, the entailment is unlikely.",3,NO
S0052838007p,B0242001p,"NO, NO, NO","1. Logical analysis: Statement 1 requires consultation of local voices, but does not necessitate that the people hold the power to make and interpret laws; a system can include advisory roles without transferring sovereignty. 2. Historical context: Argument 1 (1657) focuses on immediate grievances under Cromwell's Protectorate, seeking representation within an existing structure, while Argument 2 (1698) advocates for popular sovereignty as a republican principle; the differing contexts prevent entailment. 3. Authors' perspectives: The speaker in Argument 1 is pragmatic, urging consideration of local interests, while Algernon Sidney in Argument 2 argues for systemic change; thus, the moderate procedural claim does not imply the radical substantive claim.","I am completely sure because Statement 1 is a procedural requirement that can be satisfied without adopting the systemic change advocated in Statement 2; the logical, historical, and perspectival analyses consistently show no entailment.",4,NO
S0052529007p,B1085007p,"NO, NO, NO","1. Logical entailment requires that if Statement 1 is true, Statement 2 must be true. Statement 1 is a general claim about abuse of power leading to tyranny, while Statement 2 is a specific scenario involving a popular leader. The truth of the general does not guarantee the truth of the specific. 2. In the context of the arguments, Statement 1 arises from concerns about financial control by unaccountable entities, whereas Statement 2 addresses the danger of a charismatic individual swaying public loyalty. These are distinct threats, so one does not entail the other. 3. From a political theory perspective, tyranny can emerge from various sources such as institutional corruption, military coup, or external invasion, not necessarily from a leader whose intentions are unknown. Therefore, the potential for abuse of power does not necessarily imply the scenario described in Statement 2.","I am highly confident because the lack of logical entailment is clear: Statement 1 does not specify the mechanism of abuse, and Statement 2 describes only one possible mechanism. The arguments provide different contexts and concerns, further supporting that the statements are not entailed.",4,NO
S0020359007p,B0260001p,"NO, NO, YES","1. NO: Statement 1 emphasizes the practical necessity of parliamentary and public confidence for the King's authority to be effective, but it does not challenge the traditional source of the King's authority (e.g., hereditary right). In Argument 1, the King's legitimacy is assumed, and the focus is on maintaining support, not deriving authority from consent. Thus, Statement 1 does not entail Statement 2's foundational claim about consent as the source of legitimacy.
2. NO: 'Confidence' and 'consent' are distinct concepts. Confidence refers to ongoing trust and support, while consent refers to the initial conferral of authority. A ruler can gain confidence after seizing power without prior consent (e.g., a popular usurper), or lose confidence despite having been consented to (e.g., an elected official). Therefore, the necessity of confidence does not logically imply that consent is required for legitimacy.
3. YES: In the historical context of the Exclusion Crisis (Argument 1), the confidence of Parliament and the public was increasingly viewed as a form of consent. The argument that the King's authority depends on this confidence reflects emerging Whig ideas linking legitimacy to popular support. Thus, interpreted contextually, Statement 1 implies that consent is vital for authority, entailing Statement 2.","While both statements highlight the importance of popular support for authority, Statement 1 is primarily pragmatic, focusing on the maintenance of confidence within an existing monarchical system, whereas Statement 2 is a normative principle about the source of legitimacy. Entailment is not strict, but there is a plausible historical connection.",3,NO
