sentence_id_1,sentence_id_2,answers_12,reasonings_12,comment_12,llm_confidence_12,llm_conclusion_12
B0305001sc,B0084001sc,"YES, YES, YES","1. Logical entailment: If ruler power is limited by the consent of the governed, then the governed must have the authority to grant or withhold consent. This authority inherently includes the right to establish laws that define and enforce those limits, which is essentially the right to legislate. Therefore, Statement 1 entails Statement 2. 2. Historical/contextual: Within Algernon Sidney's arguments, the people are the source of all political power. In Argument 1, legislative power is 'essentially and radically in the People,' and in Argument 2, he defends the natural right of nations to make their own laws. Thus, the limitation of ruler power by consent presupposes the people's legislative right, making the entailment clear. 3. Philosophical principle: Both statements derive from the same foundational principle of natural liberty. Argument 2 roots the right to legislate in natural liberty, while Argument 1 shows that consent-based limitation is a manifestation of that liberty. Since natural liberty entails both, Statement 1 logically implies Statement 2.","The entailment is strongly supported by the arguments and context, though in abstract political theory they might be considered distinct.",3,YES
B0732002p,B0178004p,"YES, NO, YES","1. YES: In both arguments, forfeiture of legitimacy due to tyranny directly justifies resistance. Althusius states that when a ruler violates oath and fundamental laws, the ephors (representing the people) may resist. Sidney similarly argues that abuse of power justifies resistance, as with David and Saul. 2. NO: Althusius restricts the right to resist to ephors or optimates, not private subjects individually. Statement 2's 'the people are justified' could imply broader permission than Althusius allows, so Statement 1 does not entail Statement 2 in his framework. 3. YES: The core principle in both texts is that authority is conditional on upholding the common good. Violating oath and laws breaks this condition, morally empowering the collective people to resist. Thus, forfeiture of legitimacy logically entails justification for resistance.","While there is nuance regarding who exactly may resist, the overall context of early modern resistance theory supports that forfeiture of legitimacy implies a right to resist for the people, either directly or through representatives.",3,YES
B0106001p,B0084001p,"YES, YES, NO","1. YES: In the context of Algernon Sidney's arguments, both statements stem from the principle of natural liberty and consent. If absolute power contradicts individual rights (Statement 1), then legitimate authority must derive from the consent of the governed, which inherently grants nations the right to make their own laws and appoint magistrates (Statement 2). 2. YES: Historically, Sidney's work is a polemic against absolute monarchy and in favor of popular sovereignty. Within this framework, the rejection of absolute power (Statement 1) is a direct step towards asserting the right of nations to self-governance (Statement 2), as seen in how Argument 1 leads to Argument 2. 3. NO: From a purely logical standpoint, Statement 1 only makes a negative claim about the incompatibility of absolute power with individual rights. It does not necessarily imply the positive right of nations to legislate and appoint magistrates; there could be other political arrangements that respect individual rights without conferring that specific right to nations (e.g., a system of rule by a council of elders chosen by birth, but bound by customary law that protects individual rights).","I am fairly confident that in the context of the arguments and author's perspective, Statement 1 entails Statement 2, because Sidney explicitly links the rejection of absolute power to the need for consent-based governance, which includes the right of nations to make their own laws. However, strict logical entailment is less clear, so I am not completely sure.",3,YES
B0467001p,B0126001p,"NO, YES, NO","1. NO: From a strict logical perspective, Statement 1 is a normative claim about legitimacy, while Statement 2 is an empirical claim about historical evidence. The truth of a normative principle does not depend on empirical support; even if consent is essential for legitimacy, it does not guarantee that historical examples strongly support the idea. Thus, Statement 1 does not entail Statement 2.
2. YES: Within the context of the arguments, both authors treat consent as foundational and reference historical examples. Nicholas of Cusa cites regimes like those of Moses and Roman kings established by voluntary consent, implying historical instances of consent-based governance. Therefore, in this context, Statement 1 naturally leads to the historical support asserted in Statement 2.
3. NO: The statements serve different argumentative purposes. Statement 1 emphasizes the necessity of consent for legitimacy, which could be achieved through ongoing assent or tacit agreement, not necessarily explicit election of rulers. Statement 2 focuses specifically on rulers being chosen by consent, a narrower claim. Thus, the general principle in Statement 1 does not entail the specific historical claim in Statement 2.","I am fairly confident because, although the contextual arguments show a connection, the logical relationship between a normative principle and an empirical claim does not guarantee entailment. The differing scopes of the statements further support a lack of strict entailment.",3,NO
B0844003p,B0814007p,"YES, YES, NO","1. YES: In the context of the arguments, the 'higher authority' in Statement 1 is explicitly identified as God, and the author argues that God is the source of all order, making Statement 2 a necessary precondition or concomitant of Statement 1. Evidence: In Argument 1, Maxwell states 'God and Christ make Kings' and 'God is King of Kings'. In Argument 2, he states 'God is the Author of all Government amongst his Creatures' and that order is established by God.
2. YES: From the author's perspective as a divine right theorist, kingly power is a specific instance of the divine order governing all beings; thus, affirming Statement 1 inherently affirms the broader principle in Statement 2. The arguments are consistent and derived from the same theological foundation.
3. NO: Strictly logically, Statement 1 does not entail Statement 2 because it is possible to conceive of a system where kings derive power from a higher authority that is not God (e.g., a secular constitution) and where order is not divinely authored. Without assuming the specific context, the truth of Statement 1 does not guarantee the truth of Statement 2.","The context strongly supports that the higher authority is God and that God is the author of order. The arguments are from the same author and work, and they explicitly connect these ideas. Therefore, within this context, Statement 1 entails Statement 2 with high certainty.",4,YES
B0783002p,B0125008p,"YES, NO, YES","1. YES: Within the arguments of Milton and Sidney, the king's duty to act according to laws and the people's will is derived from the principle that authority originates from popular consent. Milton explicitly states that kings owe their power to the people, not inheritance or conquest, and Sidney argues that all legitimate government requires consent. Thus, in this context, Statement 1 implies Statement 2. | 2. NO: Logically, Statement 1 is a normative constraint on the exercise of power, while Statement 2 concerns the source of authority. One can affirm that a king must follow laws and the people's will (e.g., due to divine command or natural law) without accepting that his authority is contingent on popular consent, as seen in theories of divine right monarchy. | 3. YES: If the king must act in accordance with the will of the people, then his authority is effectively conditional on their ongoing approval. Historical examples from the arguments, such as the deposition of King Richard II by Parliament (Milton) and the election of kings by assemblies (Sidney), demonstrate that the duty to follow the people's will is underpinned by the contingent nature of authority on consent.","While the historical and argumentative context strongly associates the two statements, strict logical entailment is not absolute because Statement 1 could be true under non-consensual theories of authority. However, given the authors' perspectives, the connection is very strong.",3,NO
B0171007p,B0109008p,"YES, YES, YES","1. Consent, as described in the arguments, requires active participation from the people in conferring authority, implying they must have a say in governance. For example, Argument 1 states that 'the powers of magistrates are indeed derived from the consent of the people' and that people 'invest authority in a single person,' which necessitates their input. 2. Natural rights and consent are inherently linked in Sidney's philosophy; natural rights include liberty, and consent is the exercise of that liberty, demanding a say. Context 1 emphasizes that 'Liberty is a natural right' and that consent is the mechanism for its expression. 3. Historical examples in the arguments, such as the Israelites and Romans choosing leaders based on virtue, demonstrate that legitimate authority arises from the people's choice, which requires them to have a say, thus connecting Statement 1 and Statement 2.","The arguments and context consistently show that consent is central to legitimacy and is rooted in natural rights, making the entailment clear and well-supported.",4,YES
B0227004p,B0197008p,"YES, YES, YES","1. Logical entailment: If the King is bound by the law and must act according to the legal framework (Statement 1), then it directly follows that the law serves as the framework within which he must operate (Statement 2). 2. Contextual evidence from Argument 1: The author argues that the King is under the law, citing that the King cannot make, alter, mitigate, or interpret the law, and must act only through legally established courts, demonstrating that the law constrains his actions as a framework. 3. Contextual evidence from Argument 2: The author states that lawful Kings are defined by the law, and the King's power is the power of the law, meaning the law is the source and boundary of his authority, thus inherently serving as the operational framework.","The statements are semantically equivalent in the given context, and the entailment is logically necessary and strongly supported by the text, leaving no room for reasonable doubt.",4,YES
B0653002sc,B0122002sc,"YES, NO, YES","1. YES: Both arguments derive from a tradition of popular sovereignty. Statement 1 asserts consent as essential for government effectiveness, which aligns with the principle that consent is foundational for legitimate rule. In effectively governed societies, these principles are upheld, so Statement 1 supports Statement 2. 2. NO: Statement 1 is a normative claim about what makes government effective, but it does not imply that all governments actually uphold consent. Statement 2 is a descriptive claim about actual practice; even if consent is essential, it may not be upheld in many societies, so entailment fails. 3. YES: In the context of the authors' arguments against absolutism, Statement 1 (from Mariana) implies that without consent, governments become tyrannical and ineffective. Therefore, in well-functioning societies, the principles of freedom and consent are necessarily upheld, so Statement 1 entails Statement 2 within that context.","While the arguments share themes and both advocate for consent, Statement 1 is a conditional normative claim, and Statement 2 is a broader descriptive claim. The truth of Statement 1 does not logically guarantee the truth of Statement 2, as societies may not uphold these principles even if they are essential for effectiveness. Thus, entailment is not strict.",3,NO
B0786001p,B0128001p,"YES, YES, YES","First, in the context of the arguments, both Milton and Sidney advocate for popular sovereignty; Milton's specific claim that a king's sovereignty can derive from the people is a particular instance of Sidney's general principle that magistrates' right depends on consent, so within this shared theoretical framework, Statement 1 entails Statement 2. Second, logically, if a king's sovereignty can be derived from the people, then the people's consent is a necessary condition for that derivation, implying that the right of that king (a type of magistrate) is contingent on consent, which aligns with Statement 2. Third, historically, 17th-century English political thought increasingly emphasized popular consent over hereditary right; Statement 1 challenges absolute descent-based sovereignty and thus naturally leads to the broader claim in Statement 2 that all magistrates' legitimacy relies on the governed's consent.","I am fairly confident because the arguments and historical context strongly support the entailment, though there is a slight logical gap due to Statement 1's focus on possibility and kings versus Statement 2's universal necessity claim.",3,YES
B0785007p,B0083006p,"YES, NO, YES","1. YES: Within the arguments, both authors reject absolute monarchy and endorse popular sovereignty. Milton's challenge to descent-based authority assumes that legitimate power comes from the consent of the governed, which is a core aspect of natural liberty as described by Sidney. Thus, denying descent entails affirming the principle that empowers people to resist tyranny. 2. NO: Statement 1 is a negative claim that does not posit an alternative basis for authority. One could challenge descent while still denying natural liberty—for instance, by advocating divine right without heredity or justifying authority through conquest. Therefore, Statement 1 does not logically imply Statement 2. 3. YES: Historically, 17th-century English republican thought, as exemplified by Milton and Sidney, consistently connected the critique of hereditary right with natural law and natural liberty. Both authors wrote against Filmer's patriarchalism, and their arguments presuppose that challenging descent inherently invokes natural liberty as the foundation for political resistance.","While the historical and intellectual context strongly associates the two statements, logical entailment requires that Statement 1 necessarily implies Statement 2, which is not the case without additional premises. Thus, I am fairly confident that there is no strict entailment.",3,NO
B0732003p,B0093003p,"YES, YES, YES","1. Logical entailment: Statement 1 asserts that resistance is a right and necessary remedy when justice and welfare are threatened. Statement 2's condition (government detrimental to well-being) implies such a threat, so the right to resist includes the right to reassess and revoke authority as a specific form of resistance. 2. Historical and doctrinal alignment: Both Althusius and Sidney are part of the resistance theory tradition against absolutism. Althusius argues for resistance through ephors to depose tyrants, while Sidney argues for popular revocation of authority. Despite differences in agency, both affirm that failure of government justifies corrective action, so Statement 1's principle entails Statement 2's. 3. Conceptual necessity: If resistance is a necessary remedy to restore justice and protect welfare, then in cases where government becomes detrimental, the most effective remedy may include reassessing and revoking the authority of leaders. Thus, the truth of Statement 1 logically requires the truth of Statement 2 in such scenarios.","The statements share a core normative principle: when a government fails to serve justice and the common good, the people have the right to take corrective action. Despite nuanced differences in the authors' views on who may exercise that right, the abstracted statements are logically consistent, and Statement 1's general claim about resistance implies the more specific claim in Statement 2.",4,YES
B0302005p,B0277002p,"YES, YES, YES","1. Both statements reflect Algernon Sidney's principle of popular sovereignty. In Argument 1, he states that legislative power is 'essentially and radically in the People,' and in Argument 2, he asserts that the king's power is not inherent but given, meaning delegated. Therefore, if legislative power is rooted in the people, the king's power must be delegated. 2. Logically, if the people are the source of all authority, then any specific authority, such as that of a king, is necessarily delegated from them. Statement 1 establishes the people as the root, so Statement 2 follows as a specific case. 3. Historical context from the arguments supports this: Sidney illustrates in Argument 1 that delegates derive power from the people, and in Argument 2, he shows kings being held accountable or made by the people, indicating their power is contingent and delegated, consistent with popular sovereignty.","I am completely sure because both statements are from the same author and work, and they align with Sidney's consistent republican philosophy that all governmental power originates from the people.",4,YES
B0601005p,B0553007p,"YES, NO, YES","1. YES: Both arguments extensively cite scripture (e.g., Deuteronomy, Samuel, Romans) to support the divine ordination of kings, so in this context, accepting Statement 1 implies that scriptural references indicate such divine grant. 2. NO: Statement 1 could be true based on natural reason or philosophical arguments without relying on scripture; Suárez argues that regal power is from God as Author of nature through a natural process, not necessarily through special revelation. 3. YES: The statements are semantically linked: if kings' authority is divinely ordained (Statement 1), it follows that divine will grants such power, and scripture, as a record of divine revelation, naturally contains indications of this, as both authors demonstrate.","While the arguments heavily use scripture to support divine ordination, Statement 1 does not strictly depend on scriptural references; it could be derived from natural law or reason. Thus, entailment is not absolute, but in context, the connection is strong.",3,NO
B0773007p,B0178002p,"NO, YES, NO","1. NO: Statement 1 is a general principle that individuals can be judged, but it does not specify the criteria for judgment. Statement 2 specifies particular conditions (Law of Nature and welfare). One could have judgment based on other criteria, such as positive law or divine command, without requiring that a king's power is conditional on those specific conditions. Evidence: In Argument 1, Milton references historical examples where Roman Consuls were judged by the Senate and people, but the standard for judgment could be based on laws or the common good, not necessarily the Law of Nature explicitly. However, Milton does tie judgment to the end of preserving safety and liberty, which aligns with welfare. Still, the logical entailment is not strict because other standards could exist.
2. YES: Within the context of the arguments and the authors' perspectives, Statement 1 entails Statement 2 because both authors use the premise that no one is above judgment to argue that a king's power is conditional. For instance, Milton argues that since the people can judge a tyrant, the king's authority is contingent on protecting the people's safety and liberty. Sidney similarly argues that because kings are not above the law (and can be judged), their power is conditional on adhering to the Law of Nature and the welfare of subjects. The connection is explicit in their reasoning.
3. NO: From a strict logical analysis, Statement 1 does not entail Statement 2 because Statement 1 could be true even if a king's power were unconditional but subject to divine judgment only. For example, in a divine right monarchy, the king is not above God's judgment, but his power is not conditional on the welfare of his subjects in a way that allows human resistance. Both arguments reject this view, but the statements themselves do not specify the source of judgment. Therefore, S1 does not logically force S2 to be true.","My confidence is moderate because while the logical entailment is not strict, the historical context and the authors' reasoning strongly associate the two statements. However, the statements are not equivalent, and S1 could be interpreted in ways that do not require S2.",2,NO
B0530007p,B0347002p,"YES, NO, YES","1. YES: Both statements are rooted in the principle of popular sovereignty. Statement 1 asserts that consent is necessary for legitimacy, implying the people are the source of authority, which directly leads to Statement 2. Evidence: In Argument 1, Locke states lawful governments are built on the people's consent; in Argument 2, Brutus explicitly says the people establish kings, making them servants.
2. NO: Statement 1 is a conditional about deviation from consent undermining legitimacy, while Statement 2 is a positive claim about the king's role. One can accept Statement 1 without agreeing the king is a servant; e.g., a ruler might derive legitimacy from consent but hold independent authority. Evidence: Locke's argument focuses on conditions for legitimacy, not explicitly calling the king a servant, whereas Brutus uses the servant metaphor.
3. YES: In the historical context of early modern resistance theory, the idea that legitimacy depends on consent was coupled with rulers being accountable to the people. Locke's argument, part of this tradition, implies rulers serve the people's interests. Evidence: Locke argues governments are instituted to protect rights via consent, aligning with the notion of rulers as servants.","My confidence is high because both arguments share a foundation in popular sovereignty, but there is slight ambiguity in whether 'servant' is strictly entailed by consent-based legitimacy.",3,YES
B0776006p,B0754006p,"YES, NO, YES","1. YES: Statement 1 rejects blind obedience, which directly undermines the divine right of kings as it is often used to demand unquestioning submission. Milton argues that governance must align with law and justice, implying that any claim of divine authority without legal accountability is invalid. 2. NO: Statement 1 is a normative principle about how governance should function, while Statement 2 is a descriptive claim about the origin of royal authority. It is logically possible to believe that kings are divinely ordained but still must rule according to law and justice, so Statement 1 does not necessitate Statement 2. 3. YES: In the historical context of Milton's arguments, the call for governance based on law and justice is explicitly tied to rejecting the divine right of kings. Milton contends that no nation accepted unchecked royal power and that kingship is a human construct, making Statement 1 a foundation for Statement 2.","The entailment is context-dependent: within Milton's framework, the principle of law-based governance directly challenges divine right, but abstract logical analysis allows for separation. Given the shared context, I am moderately confident in YES.",3,YES
B0262001p,B0123006p,"YES, YES, YES","1. From Argument 2, the author explicitly states that legitimate power arises from the consent of the governed, and individuals voluntarily form societies by mutual agreement to create laws and appoint leaders, directly linking the reflection of the people's will (Statement 1) to mutual agreement (Statement 2). 2. Logically, if governments reflect the will of the people, then the establishment process must involve individuals reaching mutual agreement on laws and leaders, as supported by historical examples in the arguments, such as the Israelites choosing leaders and Romans creating governments. 3. The author's consistent perspective across both arguments is that consent and mutual agreement are essential for legitimate governance, so Statement 1, rooted in this view, entails Statement 2 as a necessary mechanism for expressing the people's will.","I am completely sure because the arguments and context directly equate the will of the people with processes of mutual agreement, leaving no room for alternative interpretations in this framework.",4,YES
B0287003p,B0159003p,"YES, YES, YES","1. Within the historical context and author's perspective, Algernon Sidney's social contract theory explicitly links the conditional submission of individuals to the collective agreement that forms the essence of just government, making Statement 1 entail Statement 2. 2. Logically, Statement 1 describes a scenario where individuals submit to authority with the expectation of common good, which inherently involves a collective restraint on liberties for that common good, thus embodying the essence described in Statement 2. 3. Textual evidence from both arguments shows that Sidney consistently argues that legitimate government arises from the people's consent and is directed toward the common good, reinforcing that Statement 1's premise leads to Statement 2's conclusion.","The arguments are from the same author and work, expressing a coherent political philosophy where the people's conditional submission is based on an implicit social contract, which is precisely the essence of just government as described. Thus, entailment is strongly supported by context.",4,YES
