sentence_id_1,sentence_id_2,answers_12,reasonings_12,comment_12,llm_confidence_12,llm_conclusion_12
S0020936003p,B0224003p,"YES, NO, NO","1. YES: Both statements reflect a concern for the public good and accountability. Statement 1's focus on public interest in impeachment implies that government actions should serve the people, aligning with Statement 2's principle that sovereign power exists to serve the people's good and liberties. 2. NO: Statement 1 is a specific claim about a legal procedure, while Statement 2 is a broad philosophical principle about the source of sovereign power. One can accept that impeachment is of public interest without agreeing that all power derives from consent (e.g., a divine-right monarchist). 3. NO: The contexts and authors differ significantly. Argument 1 is a parliamentary speech from 1679 focusing on institutional balance, while Argument 2 is a later republican treatise. The perspective of Argument 1 does not necessarily entail the radical consent theory of Algernon Sidney.","While both statements touch on themes of public welfare, Statement 1 does not logically necessitate Statement 2. The entailment fails because one can consistently affirm Statement 1 while denying Statement 2, as shown by possible historical viewpoints. Confidence is high but not absolute due to potential interpretive connections in Whig thought.",3,NO
S0022722002p,B0260001p,"YES, NO, NO","1. YES: In the historical context of the Glorious Revolution, the inherent right to demand accountability (Statement 1) was inherently linked to the idea of government by consent, as reflected in the Bill of Rights and the invitation to William and Mary, suggesting that Statement 1 implies Statement 2. 2. NO: From a logical perspective, the right to demand accountability does not necessarily mean that authority is derived from consent; accountability can be sought from governments established by force or inheritance without consent. 3. NO: Statement 1 focuses on holding government accountable for actions, while Statement 2 deals with the source of legitimacy; thus, the truth of Statement 1 does not logically require the truth of Statement 2.","I am moderately confident because while historical and philosophical connections exist, logical entailment requires that Statement 1 strictly implies Statement 2, which is not the case here due to the distinct concepts of accountability and consent.",3,NO
S0020332007p,B0767004p,"NO, NO, NO","1. Statement 1 is a procedural principle about rule of law and system integrity, while Statement 2 is a substantive claim about the source of political authority. One can endorse legal accountability without accepting that authority derives from serving the common good (e.g., divine right theories). Thus, no logical entailment. 2. The arguments come from distinct historical and philosophical contexts: Argument 1 is a Whig speech focused on immediate political corruption, while Argument 2 is a natural law treatise. Their differing scopes mean Statement 1 does not necessarily imply Statement 2. 3. Even if both statements oppose arbitrary power, Statement 1 does not entail Statement 2 because the rule of law can be upheld under various justifications for authority, not solely the common-good derivation.","While both statements reflect concerns about limiting power, they address different aspects of governance. The lack of necessary connection and the distinct contexts make entailment unlikely, but there is a small possibility of philosophical overlap that prevents absolute certainty.",3,NO
S0017077007p,B0778005p,"YES, NO, NO","1. YES: Accountability in governance implies that those in power must be subject to constraints; otherwise, accountability cannot be enforced. If the King's power were absolute, he would be above any accountability, so Statement 1 entails that power is bound by law. Evidence from Argument 1 shows that even high officials must adhere to laws and proclamations, suggesting a system where power is limited. 2. NO: Statement 1 does not specify the mechanism of accountability. Accountability could be moral, religious, or hierarchical without legal limits on the King. Argument 1 focuses on holding officials accountable to the King's proclamations, reinforcing royal authority rather than challenging absolute power. 3. NO: The historical contexts differ: Argument 1 (1677) emphasizes administrative accountability within a monarchical framework, while Argument 2 (1651) explicitly argues against absolute monarchy. Statement 1 is a general principle that does not logically necessitate the specific constitutional claim in Statement 2.","The entailment is not strict because Statement 1 is a broad principle compatible with various governance models, while Statement 2 is a specific claim about legal limits on monarchy. The contexts show differing emphases, but logical necessity is weak.",3,NO
S0023811005p,B1136006p,"NO, NO, NO","1. Statement 1 is a general normative principle about protecting citizens' rights from arbitrary power, while Statement 2 is a specific positive claim about the efficacy of a particular governance mechanism (limited terms for counsellors). The truth of the general principle does not logically guarantee that this specific mechanism fosters accountability; other mechanisms could achieve accountability, or this one might fail, so no entailment. 2. The contexts and authors differ: Statement 1 arises from a post-Glorious Revolution English speech focused on property rights and rule of law, while Statement 2 comes from Spinoza's philosophical treatise on monarchy design. Their distinct concerns and frameworks mean the statements are not directly connected in a way that one entails the other. 3. Even if safeguarding rights requires accountability, Statement 1 does not necessitate that the limited-term approach (the subject of Statement 2) is the one that fosters it. Accountability could be fostered through other means, so the truth of Statement 1 does not imply the truth of Statement 2.","I am reasonably confident that Statement 1 does not entail Statement 2 because there is no direct logical implication, even considering context. However, natural language entailment can sometimes allow for broader interpretations, so I am not absolutely certain.",3,NO
S0053175008p,B0539001p,"YES, NO, YES","1. YES: In the context of both arguments, the necessity of protecting rights against despotism implies that when despotism manifests as illegal force, resistance is a justified means to achieve that protection. This is supported by Locke's argument that tyranny justifies resistance. 2. NO: Statement 1 is a general imperative for protection, but it does not specify the means; protection could be achieved through legal and institutional safeguards without requiring the people to resist, so it does not logically entail the specific justification of resistance. 3. YES: Historically, both statements emerge from periods where resistance to tyrannical authority was debated; the principle that rights must be protected against despotism naturally leads to the conclusion that the people are justified in resisting when those rights are threatened by illegal force, as seen in Locke's explicit reasoning.","The entailment is contextually strong given the shared concern with tyranny, but there is some logical distance between the general imperative and the specific justification of resistance.",3,YES
S0023807005p,B0179002p,"YES, NO, YES","Reason 1: YES. Within the historical context of the Glorious Revolution and the political philosophy espoused in both arguments, the call for laws to reflect the will of the people (Statement 1) is intrinsically linked to the idea that legitimate authority is bound by law and consent (Statement 2). Argument 1 emphasizes that laws must reflect popular will to prevent abuse of power, aligning with Sidney's argument in Argument 2 that true authority is constrained by law and the governed's consent. Thus, in this context, Statement 1 entails Statement 2. Reason 2: NO. Statement 1 is a normative claim about what should be (laws should reflect the people's will), while Statement 2 is a descriptive claim about the nature of true authority. Normative ideals do not logically entail descriptive facts; it is possible to advocate for laws reflecting popular will without accepting that actual authority is bound by law and consent. Argument 1's speaker is arguing for reform, implying current authority may not be bound, so Statement 1 does not necessarily entail Statement 2. Reason 3: YES. Logically, if laws truly reflect the will of the people, then any authority operating under those laws is bound by them, and the laws themselves embody the consent of the governed. This conceptual link is supported by both arguments: Argument 1 sees law as a safeguard derived from popular will, and Argument 2 defines true authority as one bound by law and consent, using historical examples to show that even kings are subject to these constraints. Therefore, Statement 1 entails Statement 2.","I am fairly confident because, within the context of the arguments, both statements express the principle of popular sovereignty and limited government, making the entailment plausible. However, the normative versus descriptive distinction introduces some nuance, preventing absolute certainty.",3,YES
S0022903001sc,B0769002sc,"YES, NO, NO","1. YES: In the context of the arguments, both statements derive from the principle that political authority is a trust from the people. If legitimacy depends on duty to the people (S1), then when that duty is breached, the trust is violated, obligating the people to reclaim their power to restore legitimate governance (S2). Evidence: Argument 1 states that legitimacy is derived from duty and alignment with collective will; Argument 2 explicitly asserts the people's right and obligation to reclaim power when a king fails.
2. NO: Logical entailment requires that S1 necessarily implies S2, but one can consistently accept S1 without accepting S2. For instance, one could believe that legitimacy depends on duty but that only divine authority or other institutions (e.g., Parliament) should address a king's failure, not a direct obligation of the people to reclaim power. Historical context like the divine right of kings allows for S1 without S2.
3. NO: S1 describes a condition for legitimacy, while S2 prescribes an action. Even if legitimacy is lost due to failure of duty, it does not automatically entail an obligation for the people to reclaim power; alternative mechanisms like transfer of authority to other governing bodies (e.g., Lords and Commons, as in Argument 1) may be implied. Argument 1 suggests reallocation to Parliament, not direct popular reclamation.","I am fairly confident but not completely sure because the statements are closely related in the given context, but strict logical entailment is not absolute; one can conceive of consistent philosophical positions that accept S1 without S2.",3,NO
S0080012010p,B0248002p,"NO, NO, NO","Reason 1: Statement 1 is a normative claim about the people's role in resisting oppression, while Statement 2 is a historical claim about the basis of Saxon governance; they are logically independent, and the truth of one does not necessitate the truth of the other. Reason 2: The arguments come from different contexts—Argument 1 focuses on the Glorious Revolution and the deposition of James II, while Argument 2 discusses ancient Saxon constitutionalism; there is no direct link that implies entailment between the statements. Reason 3: Even if the people have the opportunity to deliver themselves from oppression, it does not logically follow that the Saxons' authority was specifically rooted in self-determination and the common good; other historical interpretations of Saxon governance could coexist with the principle in Statement 1.","I am completely sure because the statements are derived from distinct arguments with different subjects and scopes, and there is no necessary logical connection between them.",4,NO
S0053164003p,B0082004p,"NO, NO, NO","1. Logical analysis: Statement 1 is a normative claim about what people should demand, while Statement 2 is a conditional factual claim about betrayal. The truth of Statement 1 does not logically necessitate the truth of Statement 2, as there is no direct implication between demanding commitment and defining betrayal. 2. Contextual analysis: The contexts of the arguments differ significantly; Argument 1 focuses on oath-taking for justice in Cromwell's Commonwealth, while Argument 2 discusses natural liberty and tyranny from a philosophical standpoint. The statements address different aspects of accountability, and within their respective contexts, Statement 1 does not entail Statement 2. 3. Authorial perspective: The speaker in Argument 1 likely seeks to legitimize the existing government through oaths, without necessarily endorsing the right to depose rulers for acting against interests, whereas Algernon Sidney in Argument 2 explicitly argues for such a right. Thus, the moderate stance of Statement 1 does not entail the stronger claim of Statement 2.","I am fairly confident that Statement 1 does not entail Statement 2 because the statements are not logically equivalent and stem from different philosophical commitments, though they share a general concern about ruler accountability.",3,NO
S0019912005p,B0174006p,"YES, YES, NO","1. YES: Statement 1 asserts that the country should be allowed to rise against individuals who evade oaths, implying that those in power are not above consequences. This aligns with Statement 2's rejection of the notion that magistrates can act without consequence, as both emphasize accountability. Evidence from Argument 1 shows the call for action against those with royal commissions, and from Argument 2, Sidney argues that contracts ensure magistrates are answerable.
2. YES: The historical context of both arguments involves political turmoil and concerns over arbitrary authority. In Argument 1, the Popish Plot era fuels demands for accountability, while in Argument 2, Sidney's republican views stress the binding nature of contracts. Both authors share a perspective that governance requires checks on power, so Statement 1's specific call to action entails the general principle in Statement 2.
3. NO: Statement 1 focuses narrowly on individuals who evade oaths, particularly Catholics and Quakers, which may be a response to immediate threats rather than a broad governance principle. Statement 2 addresses the theoretical foundation of governance. Entailment requires logical necessity, but Statement 1 could be true without implying that the foundation of governance is undermined; it might be a pragmatic security measure.","I am fairly confident because both statements highlight accountability of authorities, and the contexts show shared concerns about limiting arbitrary power. However, the slight difference in specificity between the statements introduces some uncertainty, preventing a score of 4.",3,YES
S0024304005p,B0168007p,"NO, YES, NO","1. NO: Statement 1 emphasizes protecting rights and aligning governance with the people's will, but does not address the origin of power. Argument 1 focuses on governance conduct (e.g., advisors' diligence) rather than its foundation, so it does not entail Statement 2's claim about power bestowal. 2. YES: In the historical context of Argument 1, the Glorious Revolution and Bill of Rights established constitutional monarchy based on consent, so safeguarding rights and reflecting the people's will implies that power derives from the people, entailing Statement 2. 3. NO: Argument 1 is practical, concerning advice to the king and stability, while Statement 2 is philosophical about power source. Statement 1 is normative (what should be done), Statement 2 descriptive (how power is conferred), so no logical entailment.","I am fairly confident because while the contexts are related, Statement 1 does not logically necessitate Statement 2; one can advocate for protecting rights and reflecting the people's will without agreeing that power is bestowed by the people for mutual benefit.",3,NO
S0020349005p,B0223001p,"NO, NO, NO","First, from a logical perspective, Statement 1 addresses accountability of officials serving the crown, not the source or limits of the king's authority; one can have accountable officials without the king's authority being derived from consent. Second, historically, Argument 1 focuses on due process and parliamentary scrutiny during the Exclusion Crisis, while Argument 2 advocates for consent as a foundational limit on royal power; the contexts show different concerns. Third, conceptually, accountability is a procedural safeguard that can exist in absolute monarchy, whereas consent-based limits are a substantive principle of popular sovereignty; the former does not entail the latter.","The statements address distinct aspects of political authority: accountability of officials versus the foundational source of royal power. While related in promoting limitations on power, they are not in a direct entailment relationship.",3,NO
S0023870001p,B0758001p,"YES, NO, NO","1. YES: In the historical context of Argument 1, the Glorious Revolution involved deposing King James II, seen as a tyrant. The call for accountability emerged from this event, implying that when rulers are not accountable, the people have the right to depose them. Evidence: Argument 1 references the Bill of Rights, which resulted from the deposition and emphasizes accountability as essential for the new constitutional monarchy.
2. NO: Logical entailment fails because accountability can be enforced through legal and institutional means without granting a right to depose. Argument 1 focuses on due process and transparency, such as demanding a messenger be brought forth, which are internal legal mechanisms. Evidence: The argument insists on 'due process and the rule of law,' suggesting working within the system rather than overthrowing it.
3. NO: The authors' perspectives differ significantly. Argument 1 is from a supporter of constitutional monarchy seeking to strengthen governance through accountability, while Argument 2 is from John Milton, a republican advocating for the right to depose tyrants. Statement 1, reflecting the former, does not entail the more radical Statement 2. Evidence: Milton's argument cites biblical examples of overthrowing tyrants, whereas Argument 1 does not mention resistance or deposition.","While both statements emphasize limitations on rulers, Statement 1 focuses on procedural accountability within a legal framework, whereas Statement 2 asserts a right to extra-legal action in extreme cases. Entailment is not logically necessary, though there is contextual overlap.",3,NO
S0053085009p,B0024003p,"YES, NO, NO","Answer 1: YES. Statement 1 opposes treating the populace as subjects of one man, which aligns with the principle that legitimate authority requires the consent of the governed, as in Statement 2. Both arguments emphasize that power should derive from the people; Argument 1 mentions 'the will of the people' and 'mutual obligation,' implying consent, while Argument 2 explicitly states consent is necessary. Answer 2: NO. Statement 1 focuses on the form of rule (not one-man rule), while Statement 2 focuses on the origin of political power (consent). One can reject personal rule without endorsing consent theory; e.g., supporting rule by a collective or divine right. Argument 1 emphasizes formal processes like an Act of Parliament, which may represent the people without individual consent. Answer 3: NO. Historically, Argument 1 is about institutional legitimacy in 1657 England, where Parliament's authority was key but not based on individual consent. Argument 2, from a different context, asserts consent as the only basis. Thus, Statement 1's rejection of one-man rule does not logically entail that consent is the sole means of subjection to political power.","I am fairly confident because entailment requires logical necessity, and Statement 1 can be true without Statement 2 being true, as other forms of legitimacy exist. However, contextual interpretations allow for some ambiguity.",3,NO
S0022902005p,B0699001p,"NO, YES, NO","1. NO: Statement 1 focuses on a specific estate as a public trust, which is a narrower claim about property law and does not logically necessitate the broader claim about the ownership of the entire realm belonging to the people. 2. YES: Considering the historical context of Argument 1 (post-Glorious Revolution England) and the emphasis on government structure prioritizing public welfare, the concept of public trust aligns with emerging ideas of popular sovereignty, implying that the people own the realm. 3. NO: The two statements derive from distinct arguments with different scopes; Argument 1 concerns grants to the King, while Argument 2 addresses the nature of sovereignty. Without additional premises, Statement 1 does not entail Statement 2.","While Statement 1 reflects principles consistent with popular sovereignty, it does not explicitly or necessarily entail Statement 2. The confidence is high but not absolute because contextual interpretation could lead to a different conclusion.",3,NO
S0018303008p,B0783002p,"YES, NO, YES","1. YES: Both statements emphasize the centrality of the people's will in governance. If leaders must prioritize the people's will to maintain harmony (Statement 1), then specifically the king, as a leader, must act in accordance with that will (Statement 2), especially in a monarchy where the king's actions directly impact stability. 2. NO: Statement 1 is a pragmatic assertion about what is crucial to avoid strife, but it does not logically imply a categorical obligation that the king must act in accordance with laws and the people's will. It could be that prioritizing the will is merely advisable, not obligatory. 3. YES: In the historical context of 17th-century England, the 'will of the people' was often institutionalized through laws and Parliament. Thus, prioritizing the people's will (Statement 1) inherently involves acting in accordance with laws that represent that will, which aligns with Statement 2's requirement that the king act in accordance with both laws and the people's will.","The statements share a core principle that the people's will is essential for legitimate and stable governance. Given the contexts and authors' perspectives, both advocate for limitations on royal authority based on popular consent. Therefore, Statement 1, which asserts the crucial importance of prioritizing the people's will, entails Statement 2, which specifies that the king must act in accordance with that will and the laws derived from it.",4,YES
S0021058005p,B0161005p,"YES, NO, YES","1. YES: Statement 1 asserts that a monarch's purpose is to serve the populace, implying that authority is conditional on this service. If a monarch fails and becomes oppressive, it logically follows that those with virtue and power have a right to intervene to restore proper governance, as reflected in Statement 2. Both arguments share a context of opposing tyranny, with Argument 1 focusing on preventive exclusion and Argument 2 on resistance, but both stem from the principle that rulers must not harm the people.
2. NO: Statement 1 defines the monarch's role but does not specify mechanisms for enforcement. Argument 1 uses this principle to advocate for a legislative solution (exclusion bill), not extra-legal resistance by individuals. Therefore, Statement 1 does not entail Statement 2, which justifies individual virtuous action beyond institutional responses.
3. YES: Philosophically, the idea that rulers serve the people is foundational to popular sovereignty and resistance theory. This principle inherently includes the right to resist oppression when rulers violate their trust, as articulated in Statement 2. Historical examples in Argument 2 (e.g., Brutus and Cassius) align with this tradition, showing that Statement 1 supports Statement 2 within the shared Whig/republican discourse.","The entailment is plausible given the shared political philosophy and historical context, but some uncertainty remains due to differences in focus: Statement 1 addresses the monarch's role, while Statement 2 addresses individual rights of resistance. Additional premises may be needed for strict logical entailment.",3,YES
S0023982006p,B0775001p,"YES, YES, NO","1. YES: Statement 1 asserts a need for government based on popular will and rule of law, which directly contradicts the core tenet of the 'Right of Kings'—that kings derive absolute authority from God and are above human law. Thus, if Statement 1 is true, the Right of Kings cannot be justified. 2. YES: The historical contexts of Argument 1 (post-Glorious Revolution) and Argument 2 (Interregnum) both reject absolutism and affirm popular sovereignty. This shared premise makes Statement 2 a necessary implication of Statement 1 within these contexts. 3. NO: Statement 1 is a normative claim about governmental needs, not a direct denial of monarchical principles. It could theoretically coexist with a limited or constitutional monarchy that retains a notion of kingship under popular sovereignty, so Statement 1 does not strictly entail the complete unjustifiability of the Right of Kings.","While the historical and logical connections strongly suggest entailment, the possibility of a non-absolutist interpretation of the Right of Kings introduces a minor uncertainty.",3,YES
