sentence_id_1,sentence_id_2,answers_12,reasonings_12,comment_12,llm_confidence_12,llm_conclusion_12
B0749005p,B0381006p,"YES, YES, YES","1. Logical entailment: Statement 1 establishes that a king's legitimacy depends on his actions and the welfare of his subjects. If he breaks his oath or neglects duties (Statement 2), he fails to meet these conditions, thus losing legitimacy and justifying rejection. 2. Historical context: Both authors wrote in the early modern period defending resistance against tyranny. Milton's emphasis on contingent legitimacy (Statement 1) aligns with Brutus's contractual view, making Statement 2 a direct consequence within this intellectual tradition. 3. Conceptual analysis: The notion of contingent legitimacy implies a social contract; breaking an oath or neglecting duties violates that contract, entailing the people's right to withdraw allegiance, as both arguments assert.","The arguments are highly consistent and rooted in similar political theories. Statement 1 provides a general principle that directly supports the specific claim in Statement 2, leaving little room for doubt within the given context.",4,YES
B0659006p,B0124006p,"YES, YES, NO","1. YES: In Argument 1, Mariana explicitly states that legitimate royal power is established by the consent of citizens, and the community's retention of power without restrictions is a direct consequence of that consensual foundation. Therefore, Statement 1 entails Statement 2. 2. YES: Both arguments are grounded in the principle of popular sovereignty, where the people hold ultimate authority. Statement 1's claim that the community has not relinquished all power presupposes that the people originally possessed full power and delegated it conditionally, which aligns with Statement 2's assertion that legitimacy derives from consent. 3. NO: While the statements are related in consent theory, they address distinct concepts: Statement 1 concerns the extent of power transferred, while Statement 2 concerns the source of legitimacy. It is logically possible for a community to retain some powers even if the ruler's legitimacy stems from other sources (e.g., divine right or conquest), so Statement 1 does not strictly entail Statement 2.","The authors' perspectives and the context of the arguments strongly support the entailment, as both Mariana and Sidney base political authority on popular consent and condition the ruler's power on the community's retained sovereignty. The NO reason highlights a logical distinction but is not supported by the given context.",4,YES
B0221002p,B0169002p,"YES, YES, YES","1. S1 establishes that legitimate authority must be rooted in consent, so authority gained through force is illegitimate. Since force cannot create legitimacy, it follows that force cannot confer rights, aligning with S2. Evidence: Argument 1 states 'A ruler's power derived from violence or fraud cannot be considered legitimate.' 2. In Sidney's philosophy, both authority and rights originate from the people's consent. S1's focus on consent implies that force, being antithetical to consent, cannot be a source of rights, as per S2. Evidence: Argument 2 emphasizes 'no man can confer upon others that which he has not in himself' and that powers are from the people. 3. S1 implies that any authority not based on consent is illegitimate and thus cannot confer valid rights. Therefore, if an individual uses force, they lack legitimate authority and cannot confer rights, supporting S2. Evidence: Both arguments argue that usurpation and force do not create rights.","The arguments are from the same author and work, sharing a coherent philosophical stance against force and for consent. In this context, S1 logically leads to S2, making the entailment clear and confident.",4,YES
B0659005p,B0545007p,"YES, YES, YES","1. Both statements are grounded in the principle that political authority derives from the consent of the governed. Statement 1's responsibility to reclaim authority presupposes the ability to judge tyranny, which Locke explicitly identifies as fundamental to the social contract in Statement 2. 2. Historically, Mariana's argument (1598) influenced later social contract thinkers like Locke (1689). The idea that the community can resist tyranny (Statement 1) evolved into the systematic concept of the social contract, making Statement 1 a precursor that entails Statement 2. 3. Logically, if the community has a responsibility to reclaim authority (Statement 1), it must have the ability to judge when that is necessary and to act accordingly. This ability is inherently part of the social contract framework that justifies such responsibility, so Statement 1 entails Statement 2.","The entailment is supported by the shared philosophical context of consent-based authority and resistance to tyranny, though Mariana does not explicitly mention 'social contract'. Thus, confidence is high but not absolute due to terminological differences.",3,YES
B0223003p,B0093004p,"YES, YES, YES","1. Logically, if just governance requires consent of the governed, then the authority of government derives from that consent, implying that power originates from the people. 2. In Argument 1, Sidney explicitly states that legitimate authority is founded on the will of the people, directly linking consent to the idea that power originates from the people. 3. Historically, Sidney's political philosophy, as reflected in both arguments, is based on social contract theory where power originates from the people and consent is essential for legitimacy.","Both arguments are from the same author and work, and they consistently present consent as grounded in popular sovereignty, making the entailment clear within this context.",4,YES
B0781002p,B0126005p,"YES, NO, NO","1. YES: Both statements reflect the principle of popular sovereignty; if the King's authority is limited by the will of the people (Statement 1), it logically implies that ultimate political power resides with the people, which is the core claim of Statement 2. 2. NO: Statement 1 describes a specific constitutional arrangement (limited monarchy), while Statement 2 makes a broader philosophical claim about the origin of government via social contract; one can accept limited monarchy without endorsing social contract theory. 3. NO: Entailment requires that Statement 1 cannot be true without Statement 2 being true. It is conceivable that the King's authority is limited by Parliament and laws without the government being founded on mutual agreement (e.g., if parliamentary authority is derived from royal concession rather than popular grant).","My confidence is based on the distinction between a specific institutional arrangement and a general theory of political legitimacy. While the statements are philosophically aligned, they are not logically equivalent, and Statement 1 does not necessitate Statement 2.",3,NO
B0261007p,B0022003p,"YES, NO, YES","1. YES: In Argument 1, Sidney grounds the ability to reclaim sovereignty in the natural freedom of nations, which includes the right to assemble and consent to political arrangements. This implies the capacity to consent to form a community as in Statement 2. Evidence: 'Nations being naturally free may meet, when and where they please; may dispose of the Soveraignty...' (Context 1). 2. NO: Statement 1 refers to the people's ability to reclaim sovereignty, which may apply only to already constituted political communities that have lost self-determination. It does not necessarily entail that individuals in a state of nature can form a community through consent. Reclaiming could occur through force without explicit consent. Evidence: Sidney's examples involve historical nations, not individuals in a state of nature. 3. YES: Both statements are based on the concept of natural freedom. Statement 1 is a specific instance of exercising natural freedom (reclaiming sovereignty), while Statement 2 is a more general expression of that freedom (consenting to form a community). If the specific ability exists, the general ability must also exist. Evidence: Argument 1 assumes natural liberty; Argument 2 explicitly states men are free and can consent.","I am completely sure about my assessment because both statements are rooted in early modern theories of popular sovereignty and natural rights. The entailment is logical: the ability to reclaim sovereignty presupposes the capacity for collective self-determination, which includes consenting to form a community.",4,YES
B0183003p,B0111001p,"NO, NO, NO","1. Logical distinction: Statement 1 asserts a right to resist, which is permissive, while Statement 2 asserts a moral obligation ('should') to reclaim liberties. The existence of a right does not logically entail an obligation to exercise that right, as one may have a right without being required to act on it. Therefore, S1 does not entail S2.
2. Contextual scope: Although both statements derive from Sidney's arguments against tyranny, Statement 1 focuses on the right to resist wrongful acts, which could include various forms of defense (e.g., self-defense against violence). Statement 2 specifically prescribes reclaiming liberties as a response to deprivation by unjust rulers. The general right in S1 does not guarantee the specific action of reclaiming liberties mentioned in S2.
3. Conditional nature: Statement 2 is conditional on unjust rulers depriving liberties. Statement 1, while mentioning wrongful acts, does not specify that such acts always involve deprivation of liberties, nor does it address the conditions under which resistance should occur. Even if the right exists, it might not imply the normative claim in S2 under all circumstances (e.g., if reclaiming liberties would cause greater harm).","While Sidney's broader arguments suggest a strong link between the right to resist and the duty to reclaim liberties, the statements as formulated do not show strict logical entailment. The confidence is high but not absolute due to potential interpretive nuances in the author's intent.",3,NO
B0407007p,B0231008p,"NO, YES, NO","1. From a strict logical perspective, Statement 1 concerns the source of legitimacy (consent), while Statement 2 concerns the foundation of a different principle (abolishing laws); they are not logically connected, so no entailment. 2. Considering the historical context of popular sovereignty theories, Statement 1 implies that consent is necessary for legitimacy, which is often rooted in the idea that laws should reflect the collective will and welfare, so Statement 1 entails Statement 2. 3. Examining the specific arguments, Bodin's Argument 1 does not explicitly base consent on collective will, whereas Sidney's Argument 2 does, so from the authors' perspectives, Statement 1 does not entail Statement 2.","While both statements relate to consent and popular sovereignty, Statement 1 does not logically guarantee Statement 2, as they address different aspects of political theory and are derived from distinct arguments.",3,NO
B0756001p,B0379001p,"YES, YES, NO","1. YES: Both arguments are grounded in the principle that rulers are subject to law and exist for the people's welfare. Milton argues that subjects should not submit to unjust rulers because such rulers violate divine and natural law. Brutus argues that kings are accountable for misgovernment because they are trustees of the people. Therefore, if subjects should not submit (Statement 1), it implies that the ruler has breached his duty and should be held accountable (Statement 2). 2. YES: In the context of early modern resistance theory, non-submission to unjust authority is a form of holding rulers accountable. Milton's argument explicitly leads to the conclusion that resistance is permissible, which entails that the ruler is accountable for his actions. Brutus directly states that misgovernment warrants accountability. Thus, Statement 1 entails Statement 2 as a necessary consequence. 3. NO: Logically, Statement 1 does not strictly entail Statement 2 because they address different agents and actions. Statement 1 is a prescription for subjects' behavior (non-submission), while Statement 2 is a prescription for holding the king accountable. It is possible to conceive of a situation where subjects should not submit (e.g., by civil disobedience) without there being an obligation to hold the king accountable (e.g., if the king is beyond earthly judgment). The arguments may advocate both, but the statements themselves are not logically equivalent.","I am fairly confident that Statement 1 entails Statement 2 given the shared context and principles of the arguments, but there is a slight logical distinction that prevents absolute certainty.",3,YES
B0206001sc,B0166002sc,"NO, YES, NO","1. NO: Statement 1 does not logically necessitate Statement 2 because one can consistently affirm popular judgment of rulers while believing liberties were granted by a sovereign, as in historical charters like Magna Carta. 2. YES: Within Sidney's framework, both statements derive from popular sovereignty; if the people must judge rulers, they are the ultimate authority, implying liberties are inherent and not bestowed by any individual. 3. NO: The statements address different conceptual domains: procedural accountability vs. ontological origin of rights; entailment requires a necessary connection that is not present, as shown by theories where the people judge rulers to uphold liberties that were originally granted.","I am reasonably confident because while Sidney's arguments are coherent, logical entailment between the specific statements is not strict; a plausible counterexample exists where people judge rulers based on liberties bestowed by a ruler, demonstrating the lack of necessity.",3,NO
B0143008p,B0037011p,"YES, YES, NO","1. YES: Both statements are rooted in arguments that prioritize the common good. In Argument 1, Sidney asserts that 'the legitimacy of any government is contingent upon its ability to serve the needs of the populace.' In Argument 2, Marsilius states that 'the public good is the ultimate justification for actions taken by the executive' and cites 'salus populi suprema lex.' Thus, within their contexts, both authors treat service to the populace as essential for legitimacy, making Statement 1 entail Statement 2.
2. YES: The executive is a component of government. Argument 1 defines the government's primary purpose as serving the populace, and Argument 2 describes the executive as a fiduciary power existing to serve the community. Therefore, if the government's purpose requires serving the populace (Statement 1), then the executive's actions must align with that purpose to be legitimate, which is Statement 2.
3. NO: Statement 1 concerns the government's primary purpose, while Statement 2 concerns the foundation of legitimacy for executive actions. These are distinct concepts: a government could fulfill its purpose through other branches even if executive actions lack legitimacy, or legitimacy could be based on legal formality rather than public good. Moreover, the contexts differ: Sidney focuses on virtuous rulers and just monarchy, while Marsilius focuses on secular jurisdiction over clergy. Thus, without additional assumptions, Statement 1 does not strictly entail Statement 2.","The statements are highly consistent given the authors' shared emphasis on the common good, and the contexts support a strong connection. However, the difference in scope (government vs. executive) and the logical gap between 'purpose' and 'legitimacy' prevent absolute certainty.",3,YES
B1220008p,B0133001p,"NO, YES, NO","1. NO: Statement 1 is a general principle about consent and government legitimacy, while Statement 2 is a specific doctrinal point about Latin terms. The truth of Statement 1 does not logically require that the distinction between 'eligere' and 'instituere' is significant; one could affirm consent's necessity without endorsing this distinction. 2. YES: In the context of the arguments, both Cicero and Sidney emphasize explicit consent for legitimate governance. Since Statement 1 asserts that without consent government is a facade, it implies that consent is fundamental, which aligns with Statement 2's focus on explicit consent through the distinction, thus entailing its significance. 3. NO: Entailment requires that if Statement 1 is true, Statement 2 must be true. However, it is possible to believe that consent is necessary to avoid a facade (Statement 1) without agreeing that the distinction between 'eligere' and 'instituere' is significant, as consent might be achieved through other means not involving this distinction.","The entailment is not strict logical necessity; while both statements relate to consent, Statement 1 is broader and does not explicitly imply the significance of the specific distinction in Statement 2.",3,NO
B0971006p,B0049006p,"NO, NO, YES","1. NO: Statement 1 is specific to kings, while Statement 2 is universal; a specific truth does not logically entail a general truth without additional premises. 2. NO: The historical and conceptual contexts differ: Hotoman focuses on monarchy and institutional consent via the Estates, while Marsilius addresses usurpation and a broader notion of consent; thus, the statements are not necessarily equivalent. 3. YES: Within the shared framework of popular sovereignty evident in both arguments, the requirement of consent for kingly legitimacy (Statement 1) strongly supports and implies the general principle that consent is essential for any rightful authority (Statement 2).","I am reasonably confident because, although the arguments align on the importance of consent, logical entailment between a specific and a universal claim is not strict without contextual assumptions. The score reflects moderate confidence given the need to balance logical rigor with historical interpretation.",3,NO
B0230002p,B0169003p,"YES, YES, YES","1. Authorial consistency: Both statements derive from Algernon Sidney's arguments in the same work, where he posits that governance originates from the people's consent, and thus rulers cannot grant liberties they do not inherently possess. 2. Logical necessity: If governance is based on consent (Statement 1), then rulers derive authority from the governed, who are fundamentally equal; therefore, it is absurd for a ruler to claim to grant liberties to equals, as liberties are inherent and not the ruler's to give (Statement 2). 3. Contextual evidence: Historical examples in Argument 1 (e.g., Nimrod made king by Babylonians) and Argument 2 (emphasis on equality and consent) reinforce that consent-based governance invalidates the notion of rulers granting liberties to equals.","The shared context, author's perspective, and logical flow between the statements provide strong grounds for entailment, leaving little room for doubt.",4,YES
B0546001p,B0201008p,"YES, YES, YES","1. In Locke's argument, the reversion of legislative power to the people upon dissolution implies that the people are the original sovereigns; thus, any magistrate's power must derive from their consent to be legitimate, as Sidney asserts. 2. Both statements arise from 17th-century social contract theory, which holds that legitimate government requires consent; Locke's specific claim about reversion logically supports Sidney's general principle. 3. Locke ties dissolution to breaches of trust or unauthorized alterations of the legislative, showing that obligation depends on ongoing authorization, which directly entails that without such consent, power is illegitimate, aligning with Sidney's view.",The shared philosophical context of popular sovereignty and social contract theory makes the entailment between the statements strong and clear.,4,YES
B0762004p,B0747004p,"YES, YES, YES","1. Both statements are derived from the same author and work, John Milton's 'A Defence of the People of England', where he consistently argues that the people have the right to depose unfit rulers. In Argument 1, Milton states that the people can depose a ruler who abuses power or fails to govern wisely; in Argument 2, he argues that a tyrant forfeits his right to rule. Given the consistent perspective, Statement 1 entails Statement 2. 2. The conditions in Statement 1 ('abuses their power or fails to govern wisely') encompass those in Statement 2 ('becomes a tyrant and acts against the interests of the people'). In Milton's context, a ruler who abuses power or governs unwisely is acting against the people's interests, essentially becoming a tyrant. Thus, if Statement 1 is true, the condition in Statement 2 is satisfied, and the consequent of Statement 2 (forfeiture of right to rule) follows from the consequent of Statement 1 (right to remove). 3. Logically, if the people have the right to remove a ruler (Statement 1), it implies that the ruler has lost legitimacy, i.e., forfeited the right to rule (Statement 2). This is supported by Milton's reasoning that authority derives from the people's collective good, so abuse of power severs that mandate. Therefore, Statement 1 entails Statement 2.","I am completely sure about my assessment because both statements are from the same author and historical context, reflect identical principles, and logically align. Milton's arguments consistently support the people's right to depose unfit rulers, making the entailment clear.",4,YES
B0233006p,B0051005p,"YES, NO, YES","1. YES: Statement 1 asserts that kingship depends on the will of the populace. This implies that legitimate royal authority requires popular consent. Therefore, if a ruler, such as a usurper, lacks such consent, their authority is illegitimate, which is exactly what Statement 2 claims. The entailment is supported by Sidney's argument that kings are created by the people and can be deposed if they violate the public good.
2. NO: Statement 1 is a descriptive claim about the contingent nature of kingship, while Statement 2 is a normative claim prescribing that people must have freedom to consent and that usurpers are illegitimate. Logical entailment from a descriptive premise to a normative conclusion is not valid without additional normative premises. Thus, Statement 1 does not strictly entail Statement 2.
3. YES: Considering the historical context and authors' perspectives, both Sidney and Marsilius advocate for the principle that political legitimacy derives from the consent of the governed. Statement 1, derived from Sidney, and Statement 2, from Marsilius, express this same core idea. Therefore, within the framework of popular sovereignty, Statement 1 entails Statement 2.","I am reasonably confident because both statements align with the principle of popular sovereignty, though there is a slight difference in scope and normative vs descriptive claims.",3,YES
B0262001p,B0138009p,"YES, YES, YES","1. Logically, if various forms of government reflect the will of the people who established them (Statement 1), then the diversity of such forms across nations indicates that different societies have exercised their will in shaping governance. This exercise of will is equivalent to exercising the natural right to self-governance, so Statement 1 entails Statement 2. 2. Contextually, both statements derive from Algernon Sidney's argument for popular sovereignty. In Argument 2, Sidney explicitly states that diversity in governmental structures demonstrates the exercise of natural right, while Argument 1 asserts that forms reflect the people's will. Within his framework, the reflection of will is evidence of exercising natural right, so Statement 1 entails Statement 2. 3. Historically, Sidney uses examples like the Israelites and Romans to show that governments originate from popular consent. The variety of these examples supports both statements, and the truth of Statement 1, as illustrated by these cases, necessarily leads to the truth of Statement 2.","The context of Sidney's work strongly supports the entailment, as both statements express core aspects of his theory of popular sovereignty and are logically connected within his argument.",4,YES
B0682006p,B0353003p,"NO, YES, NO","1. NO: Statement 1 asserts a normative right, which does not logically entail the descriptive historical claim in Statement 2; rights exist independently of their illustration in history. 2. YES: In the context of both arguments, the 'right of the people' to depose a tyrant (Statement 1) is exercised through public authority, which historically includes assemblies of estates as described in Statement 2. 3. NO: Statement 1 is limited to tyranny, while Statement 2 includes both tyranny and incompetence, so the broader scope of Statement 2 is not entailed by Statement 1.","I am fairly confident because, although the statements are consistent, logical entailment requires that Statement 1 necessarily implies Statement 2, which is not the case due to differences in nature and scope.",3,NO
